{
  "version": 1,
  "job": "example",
  "attempt": "example",
  "input": "/home/user/Work/endoforge/campaigns/next50-20261018/runtime/attempt-947d1336/input",
  "inputSha256": "f1734a68232317c6dc71cbf33eb5858bf56b703bc1aafd29b7ba4cf893da3f70",
  "expectedSha256": "f1734a68232317c6dc71cbf33eb5858bf56b703bc1aafd29b7ba4cf893da3f70",
  "script": "cat /input.txt",
  "timeoutSeconds": 3
}
